Career_id,Career_title,Description,Skills_required,Education_required,Average_salary,Job_outlook,Work_environment,Demand_growth
1,Software Developer,"Responsible for designing, coding, and modifying software applications according to client or user requirements. Works with various programming languages and frameworks.","Programming, Problem-solving, Debugging, Software Design, Version Control, Web Development, Database Management, API Integration",Bachelor's degree in Computer Science or related field,"$105,000",22% growth (much faster than average),Office-based or Remote,0.9
2,Data Scientist,"Analyzes and interprets complex data to help organizations make better decisions. Combines expertise in statistics, mathematics, and programming.","Statistics, Machine Learning, Python, R, SQL, Data Visualization, Big Data Technologies, Problem-solving","Master's or PhD in Statistics, Computer Science, or related field","$122,000",31% growth (much faster than average),Office-based or Remote,0.95
3,UX/UI Designer,"Creates user-friendly interfaces for digital products. Focuses on the look and feel of websites, mobile apps, and software interfaces.","User Research, Wireframing, Prototyping, Visual Design, User Testing, Adobe Creative Suite, Figma, Sketch","Bachelor's degree in Design, HCI, or related field","$85,000",13% growth (faster than average),"Office-based or Remote, often in agencies or tech companies",0.75
4,Digital Marketing Specialist,Plans and executes marketing campaigns across digital channels to promote products or services and increase brand awareness.,"SEO, SEM, Social Media Marketing, Content Creation, Analytics, Email Marketing, PPC Advertising, Marketing Automation","Bachelor's degree in Marketing, Communications, or related field","$65,000",10% growth (faster than average),"Office-based or Remote, often in agencies or marketing departments",0.7
5,Cybersecurity Analyst,Protects computer systems and networks from cyber threats and responds to security breaches and incidents.,"Network Security, Vulnerability Analysis, Incident Response, Firewall Management, Security Protocols, Ethical Hacking, Cryptography","Bachelor's degree in Cybersecurity, Computer Science, or related field with security certifications","$99,000",33% growth (much faster than average),"Office-based, sometimes with on-call responsibilities",0.92
6,Cloud Architect,"Designs and oversees cloud computing strategies and solutions for organizations, ensuring scalability, security, and efficiency.","Cloud Platforms (AWS, Azure, GCP), Network Architecture, Security, Virtualization, DevOps, Containerization, IaC",Bachelor's degree in Computer Science or related field with cloud certifications,"$128,000",15% growth (faster than average),Office-based or Remote,0.88
7,Business Analyst,Analyzes business needs and processes to recommend improvements and solutions that help organizations achieve their goals.,"Requirements Gathering, Process Modeling, Data Analysis, Project Management, Communication, Documentation, SQL","Bachelor's degree in Business, IT, or related field","$85,000",14% growth (faster than average),"Office-based or Remote, collaborative team environment",0.78
8,Product Manager,"Oversees the development and launch of products, from conception to market release, ensuring they meet user needs and business objectives.","Market Research, Strategic Planning, User Stories, Roadmapping, Agile Methodologies, Cross-functional Collaboration, Analytics","Bachelor's degree in Business, Engineering, or related field","$110,000",8% growth (as fast as average),"Office-based or Remote, highly collaborative",0.82
9,DevOps Engineer,"Combines development and operations to improve collaboration and productivity by automating infrastructure, workflows, and continuously measuring application performance.","CI/CD, Infrastructure as Code, Containerization, Scripting, Cloud Platforms, Monitoring Tools, Version Control, Linux",Bachelor's degree in Computer Science or related field,"$115,000",22% growth (much faster than average),Office-based or Remote,0.9
10,AI Engineer,"Develops and implements AI models and systems that can perform tasks requiring human intelligence, such as visual perception, speech recognition, and decision-making.","Machine Learning, Deep Learning, Python, TensorFlow, PyTorch, Natural Language Processing, Computer Vision, Mathematics","Master's or PhD in Computer Science, AI, or related field","$135,000",31% growth (much faster than average),"Office-based or Remote, research-oriented environments",0.96
11,Blockchain Developer,"Develops and implements blockchain-based solutions and systems, including smart contracts and decentralized applications.","Blockchain Protocols, Smart Contracts, Cryptography, Solidity, Web3.js, Distributed Systems, Security",Bachelor's degree in Computer Science or related field,"$120,000",15% growth (faster than average),"Office-based or Remote, often in startups or financial tech",0.85
12,Healthcare IT Specialist,"Implements and manages information technology systems within healthcare settings, ensuring data security and compliance with regulations.","Electronic Health Records, Healthcare Regulations, System Implementation, Technical Support, Data Security, HIPAA Compliance","Bachelor's degree in Health Informatics, IT, or related field","$88,000",9% growth (as fast as average),"Healthcare facilities, hospitals, clinics",0.76
13,E-commerce Manager,"Oversees online sales strategies and operations, including website management, customer experience, and digital marketing for online retailers.","E-commerce Platforms, CRM Systems, Digital Marketing, Analytics, Inventory Management, Customer Experience, Payment Systems","Bachelor's degree in Business, Marketing, or related field","$78,000",10% growth (faster than average),"Office-based or Remote, retail or e-commerce companies",0.79
14,Renewable Energy Engineer,"Designs, develops, and implements clean energy solutions such as solar, wind, and hydroelectric power systems.","Engineering Principles, Renewable Technologies, Project Management, Technical Drawing, Environmental Regulations, Energy Modeling",Bachelor's degree in Engineering with focus on renewable energy,"$92,000",8% growth (as fast as average),"Office and field work, often in remote locations",0.84
15,Supply Chain Analyst,"Analyzes and optimizes the flow of products and materials from suppliers to consumers, improving efficiency and reducing costs.","Logistics Management, Data Analysis, Inventory Management, Forecasting, ERP Systems, Process Improvement, Procurement","Bachelor's degree in Supply Chain Management, Business, or related field","$75,000",7% growth (as fast as average),Office-based with occasional warehouse or facility visits,0.74
